sku;visible;#url#;price;"compare price";typePrefix;currencyId;category;market_category;images;store;pickup;delivery;brand;vendorCode;name;description;sales_notes;manufacturer_warranty;seller_warranty;Тип;Подтип;Стиль;Интерьер;Цвет;"Виды материалов";"Количество ламп";"Площадь освещения, м2";"Общая мощность, W";"Цвет арматуры";"Цвет плафонов";"Форма плафона";"Материал арматуры";"Материал плафонов";"Тип лампочки (основной)";"Мощность лампы, W";"Пульт ДУ";"Лампы в комплекте";"Тип цоколя";"Степень защиты, IP";"Диаметр, мм";"Высота, мм";"Длина, мм";"Ширина, мм";"Глубина, мм";"Температура света, K";"Напряжение, V";"Артикул производителя";Коллекция;"Группа товаров";Гарантия;"Место установки";питание;street;LED;Страна;Производитель;delivery-options;"Сфера применения";"Световой поток, лм";"Тип лампочки (дополнительный)";"Тип элемента питания";"Тип цоколя (дополнительный)";url;featured;variant;currency;weight;stock;"meta title";"meta keywords";"meta description";annotation
S000102;1;http://sevenlight.ru/products/potolochnaya-lyustra-eurosvet-700175-belyj-s-zolotom;6300;0;люстра;RUR;"Люстры/Люстры  по цене/Недорогие потолочные люстры";;http://sevenlight.ru/files/products/eurosvet_700175belyjszolotom.png,http://sevenlight.ru/files/products/eurosvet_700175belyjszolotom-1.png;false;false;true;Eurosvet;S000102;"люстра потолочная Eurosvet 70017/5 белый с золотом";" - хорошее решение для интерьеров с небольшими потолками. потолочная люстра прекрасно впишется не только в коридор или спальню, но также и в остальные помещения вашего интерьера. могут быть большими по размеру и быть подходящими и для больших помещений с низкими потолками. Отличным вариантом будет потолочная люстра 70017/5 белый с золотом 70017 бренда Eurosvet, Китай. Данный бренд зарекомендовал себя как надежный изготовитель люстр и светильников, пользующийся хорошим спросом среди российских покупателей. Интересный внешний вид изделия потолочная люстра 70017/5 белый с золотом сочетается с надежным качеством и практичностью. Эта модель прекрасно впишется в классика интерьер, и не только. Цвет каркаса изделия - белый, а материал изготовления - металл, плафоны имеют белый цвет. Гармоничная форма и продуманная функциональность данной модели несомненно придаст теплую и радостную атмосферу, независимо от того куда вы собираетесь ее установить. потолочная люстра 70017/5 белый с золотом подойдет для помещения площадью 16.7 кв. м, это устройство оснащено лампочками в колличестве - 5 шт. Номинальная мощность составляет 300 ватт. Степень пылевлагозащищенности по международной классификации (Ingress Protection Rating) - IP20. В нашем интернет магазине Sevenlight.ru вы можете купить потолочная люстра Eurosvet 70017/5 белый с золотом по цене с доставкой по Москве и всей России прямо сейчас! В нашем интернет магазине вы имеете уникальную возможность купить данный товар по самой низкой цене в интернете!!! Чтобы получить скидку, используйте код купона REGION при оформлении заказа.";"Мин. сумма 100 р. ";true;true;люстра;потолочная;Прованс;"для гостиной";белый;стеклянные;5;16.7;300;белый;белый;конусный;металл;стекло;накаливания;60;"без пульта";;E14;20;670;280;0;0;;;220;"70017/5 белый с золотом";70017;"основной товар";"18 месяцев";"на потолок";220;нет;НЕТ;Китай;Eurosvet;"
	
	";;;;;;;;;1;;;;;;
S000103;0;http://sevenlight.ru/products/potolochnaya-lyustra-odeon-keba-15998;18789;0;люстра;RUR;"Люстры/Люстры по стилю/Люстры флористика";;http://sevenlight.ru/files/products/odeon_15998.png;false;false;true;Odeon;S000103;"люстра потолочная Odeon 1599/8";" - хорошее решение для интерьеров с небольшими потолками. потолочная люстра прекрасно впишется не только в коридор или спальню, но также и в остальные помещения вашего интерьера. могут быть большими по размеру и быть подходящими и для больших помещений с низкими потолками. Отличным вариантом будет потолочная люстра 1599/8 Keba бренда Odeon, Италия. Данный бренд зарекомендовал себя как надежный изготовитель люстр и светильников, пользующийся хорошим спросом среди российских покупателей. Интересный внешний вид изделия потолочная люстра 1599/8 сочетается с надежным качеством и практичностью. Эта модель прекрасно впишется в прованс интерьер, и не только. Цвет каркаса изделия - коричневый, а материал изготовления - металл, плафоны имеют белый цвет. Гармоничная форма и продуманная функциональность данной модели несомненно придаст теплую и радостную атмосферу, независимо от того куда вы собираетесь ее установить. потолочная люстра 1599/8 подойдет для помещения площадью 17.8 кв. м, это устройство оснащено лампочками в колличестве - 8 шт. Номинальная мощность составляет 320 ватт. Степень пылевлагозащищенности по международной классификации (Ingress Protection Rating) - IP20. В нашем интернет магазине Sevenlight.ru вы можете купить потолочная люстра Odeon 1599/8 по цене с доставкой по Москве и всей России прямо сейчас! В нашем интернет магазине вы имеете уникальную возможность купить данный товар по самой низкой цене в интернете!!! Чтобы получить скидку, используйте код купона REGION при оформлении заказа.";"Мин. сумма 100 р. ";true;true;люстра;потолочная;прованс;"для гостиной";белый;стеклянные;8;17.8;320;коричневый;белый;флористика;металл;стекло;накаливания;40;"без пульта";;E14;20;820;350;;820;;;220;1599/8;Keba;"основной товар";"18 месяцев";"на потолок";220;нет;НЕТ;Италия;Odeon;"
	
	";;;;;;;;;1;;;;;;
S000104;1;http://sevenlight.ru/products/vstraivaemyj-svetilnik-novotech-aqua-369302;962;1347;светильник;RUR;"Светильники/Светильники по типу/Светильники влагозащищенные";;http://sevenlight.ru/files/products/novotech_369302-1.png,http://sevenlight.ru/files/products/novotech_369302-2.png,http://sevenlight.ru/files/products/novotech_369302-3.png,http://sevenlight.ru/files/products/novotech_369302.png;false;false;true;Novotech;S000104;"светильник встраиваемый Novotech 369302";" - хорошее решение для интерьеров с небольшими потолками. встраиваемый светильник прекрасно впишется не только в коридор или спальню, но также и в остальные помещения вашего интерьера. могут быть большими по размеру и быть подходящими и для больших помещений с низкими потолками. Отличным вариантом будет встраиваемый светильник 369302 Aqua бренда Novotech, Венгрия. Данный бренд зарекомендовал себя как надежный изготовитель люстр и светильников, пользующийся хорошим спросом среди российских покупателей. Интересный внешний вид изделия встраиваемый светильник 369302 сочетается с надежным качеством и практичностью. Эта модель прекрасно впишется в современный интерьер, и не только. Цвет каркаса изделия - матовый никель, а материал изготовления - металл, плафоны имеют прозрачный цвет. Гармоничная форма и продуманная функциональность данной модели несомненно придаст теплую и радостную атмосферу, независимо от того куда вы собираетесь ее установить. встраиваемый светильник 369302 подойдет для помещения площадью 2.8 кв. м, это устройство оснащено лампочками в колличестве - 1 шт. Номинальная мощность составляет 50 ватт. Степень пылевлагозащищенности по международной классификации (Ingress Protection Rating) - IP65. В нашем интернет магазине Sevenlight.ru вы можете купить встраиваемый светильник Novotech 369302 по цене с доставкой по Москве и всей России прямо сейчас! В нашем интернет магазине вы имеете уникальную возможность купить данный товар по самой низкой цене в интернете!!! Чтобы получить скидку, используйте код купона REGION при оформлении заказа.";"Мин. сумма 77 р. ";true;true;светильник;встраиваемый;Современный;"для ванной";"матовый никель";металлические;1;2.8;50;никель;прозрачный;круглый;металл;стекло;галогеновая;50;"без пульта";;GX5.3;65;85;27;0;0;;;12;369302;Aqua;"основной товар";"18 месяцев";врезные;12;да;НЕТ;Венгрия;Novotech;;;;;;;;;;1;;;;;;
S000105;1;http://sevenlight.ru/products/bra-citilux-arista-cl164311;2330;3262;бра;RUR;"Бра/Бра по форме/Бра круглые";;http://sevenlight.ru/files/products/citilux_cl164311.png,http://sevenlight.ru/files/products/citilux_cl164311-1.png;false;false;true;Citilux;S000105;"бра Citilux CL164311";" - хорошее решение для интерьеров с небольшими потолками. бра прекрасно впишется не только в коридор или спальню, но также и в остальные помещения вашего интерьера. могут быть большими по размеру и быть подходящими и для больших помещений с низкими потолками. Отличным вариантом будет бра CL164311 Ариста бренда Citilux, Дания. Данный бренд зарекомендовал себя как надежный изготовитель люстр и светильников, пользующийся хорошим спросом среди российских покупателей. Интересный внешний вид изделия бра CL164311 сочетается с надежным качеством и практичностью. Эта модель прекрасно впишется в современный интерьер, и не только. Цвет каркаса изделия - коричневый, а материал изготовления - дерево, плафоны имеют белый цвет. Гармоничная форма и продуманная функциональность данной модели несомненно придаст теплую и радостную атмосферу, независимо от того куда вы собираетесь ее установить. бра CL164311 подойдет для помещения площадью 4.2 кв. м, это устройство оснащено лампочками в колличестве - 1 шт. Номинальная мощность составляет 75 ватт. Степень пылевлагозащищенности по международной классификации (Ingress Protection Rating) - IP20. В нашем интернет магазине Sevenlight.ru вы можете купить бра Citilux CL164311 по цене с доставкой по Москве и всей России прямо сейчас! В нашем интернет магазине вы имеете уникальную возможность купить данный товар по самой низкой цене в интернете!!! Чтобы получить скидку, используйте код купона REGION при оформлении заказа.";"Мин. сумма 100 р. ";true;true;бра;;Современный;"для офиса";белый;деревянные;1;4.2;75;коричневый;белый;круглый;дерево;стекло;накаливания;75;"без пульта";;E27;20;;190;0;150;190;;220;CL164311;Ариста;"основной товар";"18 месяцев";"на стену";220;нет;НЕТ;Дания;Citilux;;;;;;;;;;1;;;;;;
S000106;1;http://sevenlight.ru/products/torsher-arte-lamp-california-a2872pn-1ab;10990;11990;торшер;RUR;"Торшеры/Торшеры по стране/Торшеры Италия";;http://sevenlight.ru/files/products/artelamp_a2872pn1ab.png,http://sevenlight.ru/files/products/artelamp_a2872pn1ab-1.png;false;false;true;"Arte Lamp";S000106;"торшер Arte Lamp A2872PN-1AB";" имеют большую популярность и предназначаются для множества интерьеров, главное правильно выбрать подходящий вариант из категории. Если Вам нужно купить надежные и привлекательные. Хорошим выбором для обустройства вашего жилища будет торшер Arte Lamp A2872PN-1AB(Италия).Важно обратить внимание, торшер A2872PN-1AB Arte Lamp соответствуем всем стандартам качества, это значит, вам не стоит переживать за надежность данного изделия, ведь торшер A2872PN-1AB California &mdash; сертифицированный продукт, прошедший все надлежащие проверки. Фабрика Arte Lamp очень тщательно следит за уровнем качества выпускаемой продукции. торшер Arte Lamp A2872PN-1AB серии California имеет соответствующий дизайн в стиле - классика. Материал, используемый в модели Arte Lamp California &mdash; это металл, а гармонично подобранные цвета дизайнерами фабрики Arte Lamp, из которых состоит торшер A2872PN-1AB &mdash; это бронза, белый. торшер Arte Lamp California отлично подойдет как для гостиной, так и для других помещений, исполненных в стиле классика. торшер A2872PN-1AB в среднем освещает помещение площадью 5.6 кв. м. Лампочек данная модель имеет 1xE27, общая мощность которых - 100 ватт. Показатель защиты от влаги - IP20. торшер Arte LampA2872PN-1AB удачно сочетает в себе внешний вид, выполненный в стиле классика и функциональные данные. Что несомненно является преимуществом приятной покупки. Купить модель торшер A2872PN-1AB производителя Arte Lamp за";"Мин. сумма 100 р. ";true;true;торшер;;Ретро;"для гостиной";белый;текстильные;1;5.6;100;Бронза;белый;конусный;металл;ткань;накаливания;100;"без пульта";;E27;20;550;1400;550;340;;;220;A2872PN-1AB;California;"основной товар";"18 месяцев";"на пол";220;нет;НЕТ;Италия;"Arte Lamp";"
	
	";;;;;;;;;1;;;;;;
S000107;0;http://sevenlight.ru/products/podvesnaya-lyustra-arte-lamp-venezia-a2106lm-5ab;16900;24913;люстра;RUR;"Люстры/Люстры по форме/Круглые люстры";;http://sevenlight.ru/files/products/artelamp_a2106lm5ab.png,http://sevenlight.ru/files/products/artelamp_a2106lm5ab-1.png;false;false;true;"Arte Lamp";S000107;"люстра подвесная Arte Lamp A2106LM-5AB";" - хорошее решение для интерьеров с небольшими потолками. подвесная люстра прекрасно впишется не только в коридор или спальню, но также и в остальные помещения вашего интерьера. могут быть большими по размеру и быть подходящими и для больших помещений с низкими потолками. Отличным вариантом будет подвесная люстра A2106LM-5AB Venezia бренда Arte Lamp, Италия. Данный бренд зарекомендовал себя как надежный изготовитель люстр и светильников, пользующийся хорошим спросом среди российских покупателей. Интересный внешний вид изделия подвесная люстра A2106LM-5AB сочетается с надежным качеством и практичностью. Эта модель прекрасно впишется в современный интерьер, и не только. Цвет каркаса изделия - бронза, а материал изготовления - металл, плафоны имеют желтый цвет. Гармоничная форма и продуманная функциональность данной модели несомненно придаст теплую и радостную атмосферу, независимо от того куда вы собираетесь ее установить. подвесная люстра A2106LM-5AB подойдет для помещения площадью 16.7 кв. м, это устройство оснащено лампочками в колличестве - 5 шт. Номинальная мощность составляет 300 ватт. Степень пылевлагозащищенности по международной классификации (Ingress Protection Rating) - IP20. В нашем интернет магазине Sevenlight.ru вы можете купить подвесная люстра Arte Lamp A2106LM-5AB по цене с доставкой по Москве и всей России прямо сейчас! В нашем интернет магазине вы имеете уникальную возможность купить данный товар по самой низкой цене в интернете!!! Чтобы получить скидку, используйте код купона REGION при оформлении заказа.";"Мин. сумма 100 р. ";true;true;люстра;подвесная;Ретро;"для гостиной";желтый;стеклянные;5;16.7;300;Бронза;желтый;круглый;металл;стекло;накаливания;60;"без пульта";;E14;20;620;380;0;0;;;220;A2106LM-5AB;Venezia;"основной товар";"18 месяцев";"на потолок";220;нет;НЕТ;Италия;"Arte Lamp";"
	
	";;;;;;;;;1;;;;;;
