sku;visible;#url#;price;"compare price";typePrefix;currencyId;category;market_category;images;store;pickup;delivery;brand;vendorCode;name;description;sales_notes;manufacturer_warranty;seller_warranty;Тип;Подтип;Стиль;Интерьер;Цвет;"Виды материалов";"Количество ламп";"Площадь освещения, м2";"Общая мощность, W";"Цвет арматуры";"Цвет плафонов";"Форма плафона";"Материал арматуры";"Материал плафонов";"Тип лампочки (основной)";"Мощность лампы, W";"Пульт ДУ";"Лампы в комплекте";"Тип цоколя";"Степень защиты, IP";"Диаметр, мм";"Высота, мм";"Длина, мм";"Ширина, мм";"Глубина, мм";"Температура света, K";"Напряжение, V";"Артикул производителя";Коллекция;"Группа товаров";Гарантия;"Место установки";питание;street;LED;Страна;Производитель;delivery-options;"Сфера применения";"Световой поток, лм";"Тип лампочки (дополнительный)";"Тип элемента питания";"Тип цоколя (дополнительный)";url;featured;variant;currency;weight;stock;"meta title";"meta keywords";"meta description";annotation
S000303;0;http://sevenlight.ru/products/potolochnaya-lyustra-elvan-lu00110-3b;2700;3780;люстра;RUR;"Люстры/Люстры  по цене/Недорогие потолочные люстры";;http://sevenlight.ru/files/products/elvan_lu001103b.jpeg,http://sevenlight.ru/files/products/elvan_lu001103b.png;false;false;true;Elvan;S000303;"люстра потолочная Elvan LU00110-3B";" имеют большую популярность и предназначаются для множества интерьеров, главное правильно выбрать подходящий вариант из категории. Если Вам нужно купить надежные и привлекательные. Хорошим выбором для обустройства вашего жилища будет потолочная люстра Elvan LU00110-3B(Россия).Важно обратить внимание, люстра LU00110-3B Elvan соответствуем всем стандартам качества, это значит, вам не стоит переживать за надежность данного изделия, ведь люстра LU00110-3B 110 &mdash; сертифицированный продукт, прошедший все надлежащие проверки. Фабрика Elvan очень тщательно следит за уровнем качества выпускаемой продукции. люстра Elvan LU00110-3B серии 110 имеет соответствующий дизайн в стиле - современный. Материал, используемый в модели Elvan 110 &mdash; это металл, а гармонично подобранные цвета дизайнерами фабрики Elvan, из которых состоит люстра LU00110-3B &mdash; это серебро, матовый никель. потолочная люстра Elvan 110 отлично подойдет как для гостиной, так и для других помещений, исполненных в стиле современный. люстра LU00110-3B в среднем освещает помещение площадью 10 кв. м. Лампочек данная модель имеет 3xE14, общая мощность которых - 180 ватт. Показатель защиты от влаги - IP20. потолочная люстра ElvanLU00110-3B удачно сочетает в себе внешний вид, выполненный в стиле современный и функциональные данные. Что несомненно является преимуществом приятной покупки. Купить модель люстра LU00110-3B производителя Elvan за";"Мин. сумма 100 р. ";true;true;люстра;потолочная;Современный;"для гостиной";серебро;металлические;3;10;180;серебро;никель;овал;металл;металл;накаливания;60;"без пульта";;E14;20;580;250;0;0;;;220;LU00110-3B;110;"основной товар";"18 месяцев";"на потолок";220;нет;НЕТ;Россия;Elvan;;;;;;;;;;1;;;;;;
S000304;0;http://sevenlight.ru/products/torsher-markslojd-tingsryd-104342;5248;6069;торшер;RUR;"Торшеры/Торшеры по бренду/Торшеры Markslojd";;http://sevenlight.ru/files/products/markslojd_104342.png,http://sevenlight.ru/files/products/markslojd_104342-1.png;false;false;true;Markslojd;S000304;"торшер Markslojd 104342";" - хорошее решение для интерьеров с небольшими потолками. торшер прекрасно впишется не только в коридор или спальню, но также и в остальные помещения вашего интерьера. могут быть большими по размеру и быть подходящими и для больших помещений с низкими потолками. Отличным вариантом будет торшер 104342 Tingsryd бренда Markslojd, Швеция. Данный бренд зарекомендовал себя как надежный изготовитель люстр и светильников, пользующийся хорошим спросом среди российских покупателей. Интересный внешний вид изделия торшер 104342 сочетается с надежным качеством и практичностью. Эта модель прекрасно впишется в современный интерьер, и не только. Цвет каркаса изделия - хром, а материал изготовления - металл, плафоны имеют черный цвет. Гармоничная форма и продуманная функциональность данной модели несомненно придаст теплую и радостную атмосферу, независимо от того куда вы собираетесь ее установить. торшер 104342 подойдет для помещения площадью 2.2 кв. м, это устройство оснащено лампочками в колличестве - 1 шт. Номинальная мощность составляет 40 ватт. Степень пылевлагозащищенности по международной классификации (Ingress Protection Rating) - IP20. В нашем интернет магазине Sevenlight.ru вы можете купить торшер Markslojd 104342 по цене с доставкой по Москве и всей России прямо сейчас! В нашем интернет магазине вы имеете уникальную возможность купить данный товар по самой низкой цене в интернете!!! Чтобы получить скидку, используйте код купона REGION при оформлении заказа.";"Мин. сумма 100 р. ";true;true;торшер;;Современный;"для офиса";черный;металлические;1;2.2;40;хром;черный;полукруг;металл;металл;накаливания;40;"без пульта";;E14;20;380;1330;0;380;;;220;104342;Tingsryd;"основной товар";"18 месяцев";"на пол";220;нет;НЕТ;Швеция;Markslojd;"
	
	";;;;;;;;;1;;;;;;
S000305;0;http://sevenlight.ru/products/potolochnyj-svetodiodnyj-svetilnik-lucide-casper-1-791661212;5778;0;светильник;RUR;"Светильники/Светильники по типу/Светильники светодиодные накладные";;http://sevenlight.ru/files/products/lucide_791661212.png,http://sevenlight.ru/files/products/lucide_791661212-1.png;false;false;true;Lucide;S000305;"светильник потолочный Lucide 79166/12/12";" имеют большую популярность и предназначаются для множества интерьеров, главное правильно выбрать подходящий вариант из категории. Если Вам нужно купить надежные и привлекательные. Хорошим выбором для обустройства вашего жилища будет потолочный светильник Lucide 79166/12/12(Бельгия).Важно обратить внимание, светильник 79166/12/12 Lucide соответствуем всем стандартам качества, это значит, вам не стоит переживать за надежность данного изделия, ведь светильник 79166/12/12 Casper 1 &mdash; сертифицированный продукт, прошедший все надлежащие проверки. Фабрика Lucide очень тщательно следит за уровнем качества выпускаемой продукции. светильник Lucide 79166/12/12 серии Casper 1 имеет соответствующий дизайн в стиле - современный. Материал, используемый в модели Lucide Casper 1 &mdash; это металл, а гармонично подобранные цвета дизайнерами фабрики Lucide, из которых состоит светильник 79166/12/12 &mdash; это хром, белый. потолочный светильник Lucide Casper 1 отлично подойдет как для кухни, так и для других помещений, исполненных в стиле современный. светильник 79166/12/12 в среднем освещает помещение площадью 6 кв. м. Лампочек данная модель имеет 1xLED, общая мощность которых - 12 ватт. Показатель защиты от влаги - IP20. потолочный светильник Lucide79166/12/12 удачно сочетает в себе внешний вид, выполненный в стиле современный и функциональные данные. Что несомненно является преимуществом приятной покупки. Купить модель светильник 79166/12/12 производителя Lucide за";"Мин. сумма 100 р. ";true;true;светильник;потолочный;Современный;"для кухни";белый;пластиковые;1;6;12;хром;белый;круглый;металл;акрил;светодиодная;12;"без пульта";да;LED;20;300;90;0;0;;;220;79166/12/12;"Casper 1";"основной товар";"18 месяцев";"на потолок";220;нет;ДА;Бельгия;Lucide;"
	
	";;900;;;;;;;1;;;;;;
S000306;1;http://sevenlight.ru/products/spot-novotech-night-light-357325;586;0;спот;RUR;"Споты/Споты по стилю/Споты хай-тек";;http://sevenlight.ru/files/products/novotech_357325-1.png,http://sevenlight.ru/files/products/novotech_357325-2.png,http://sevenlight.ru/files/products/novotech_357325-3.png,http://sevenlight.ru/files/products/novotech_357325.png;false;false;true;Novotech;S000306;"спот Novotech 357325";" имеют большую популярность и предназначаются для множества интерьеров, главное правильно выбрать подходящий вариант из категории. Если Вам нужно купить надежные и привлекательные. Хорошим выбором для обустройства вашего жилища будет спот Novotech 357325(Венгрия).Важно обратить внимание, спот 357325 Novotech соответствуем всем стандартам качества, это значит, вам не стоит переживать за надежность данного изделия, ведь спот 357325 Night Light &mdash; сертифицированный продукт, прошедший все надлежащие проверки. Фабрика Novotech очень тщательно следит за уровнем качества выпускаемой продукции. спот Novotech 357325 серии Night Light имеет соответствующий дизайн в стиле - современный. Материал, используемый в модели Novotech Night Light &mdash; это пластик, а гармонично подобранные цвета дизайнерами фабрики Novotech, из которых состоит спот 357325 &mdash; это серебро, белый. спот Novotech Night Light отлично подойдет как для спальни, так и для других помещений, исполненных в стиле современный. спот 357325 в среднем освещает помещение площадью 0.3 кв. м. Лампочек данная модель имеет 1xLED, общая мощность которых - 0.5 ватт. Показатель защиты от влаги - IP20. спот Novotech357325 удачно сочетает в себе внешний вид, выполненный в стиле современный и функциональные данные. Что несомненно является преимуществом приятной покупки. Купить модель спот 357325 производителя Novotech за";"Мин. сумма 47 р. ";true;true;спот;;Хай-тек;"для спальни";серебро;пластиковые;1;0.3;0.5;серебро;белый;декоративный;пластик;пластик;светодиодная;0.5;"без пульта";да;LED;20;;56;82;80;;;220;357325;"Night Light";"основной товар";"18 месяцев";"на стену";220;нет;НЕТ;Венгрия;Novotech;;;;;;;;;;1;;;;;;
S000307;1;http://sevenlight.ru/products/potolochnyj-svetilnik-brilliant-magnolia-9385375;6091;0;светильник;RUR;"Светильники/Светильники по типу/Светильники влагозащищенные";;http://sevenlight.ru/files/products/brilliant_9385375.png,http://sevenlight.ru/files/products/brilliant_9385375-1.png;false;false;true;Brilliant;S000307;"светильник потолочный Brilliant 93853/75";" имеют большую популярность и предназначаются для множества интерьеров, главное правильно выбрать подходящий вариант из категории. Если Вам нужно купить надежные и привлекательные. Хорошим выбором для обустройства вашего жилища будет потолочный светильник Brilliant 93853/75(Германия).Важно обратить внимание, светильник 93853/75 Brilliant соответствуем всем стандартам качества, это значит, вам не стоит переживать за надежность данного изделия, ведь светильник 93853/75 Magnolia &mdash; сертифицированный продукт, прошедший все надлежащие проверки. Фабрика Brilliant очень тщательно следит за уровнем качества выпускаемой продукции. светильник Brilliant 93853/75 серии Magnolia имеет соответствующий дизайн в стиле - современный. Материал, используемый в модели Brilliant Magnolia &mdash; это металл, а гармонично подобранные цвета дизайнерами фабрики Brilliant, из которых состоит светильник 93853/75 &mdash; это хром, белый. потолочный светильник Brilliant Magnolia отлично подойдет как для ванной, так и для других помещений, исполненных в стиле современный. светильник 93853/75 в среднем освещает помещение площадью 6.7 кв. м. Лампочек данная модель имеет 3xE27, общая мощность которых - 120 ватт. Показатель защиты от влаги - IP44. потолочный светильник Brilliant93853/75 удачно сочетает в себе внешний вид, выполненный в стиле современный и функциональные данные. Что несомненно является преимуществом приятной покупки. Купить модель светильник 93853/75 производителя Brilliant за";"Мин. сумма 100 р. ";true;true;светильник;потолочный;Современный;"для ванной";белый;стеклянные;3;6.7;120;хром;белый;круглый;металл;стекло;накаливания;40;"без пульта";;E27;44;;110;330;330;;;230;93853/75;Magnolia;"основной товар";"18 месяцев";"на потолок";230;да;НЕТ;Германия;Brilliant;"
	
	";;;;;;;;;1;;;;;;
S000308;1;http://sevenlight.ru/products/podvesnoj-svetilnik-lussole-loft-lsp-9630;4312;0;светильник;RUR;"Светильники/Светильники по бренду/Светильники Lussole";;http://sevenlight.ru/files/products/lussole_lsp9630-1.png,http://sevenlight.ru/files/products/lussole_lsp9630-2.png,http://sevenlight.ru/files/products/lussole_lsp9630-3.png,http://sevenlight.ru/files/products/lussole_lsp9630.png,http://sevenlight.ru/files/products/lussole_lsp9630-4.png;false;false;true;Lussole;S000308;"светильник подвесной Lussole LSP-9630";" - хорошее решение для интерьеров с небольшими потолками. подвесной светильник прекрасно впишется не только в коридор или спальню, но также и в остальные помещения вашего интерьера. могут быть большими по размеру и быть подходящими и для больших помещений с низкими потолками. Отличным вариантом будет подвесной светильник LSP-9630 Loft бренда Lussole, Италия. Данный бренд зарекомендовал себя как надежный изготовитель люстр и светильников, пользующийся хорошим спросом среди российских покупателей. Интересный внешний вид изделия подвесной светильник LSP-9630 сочетается с надежным качеством и практичностью. Эта модель прекрасно впишется в лофт интерьер, и не только. Цвет каркаса изделия - хром, а материал изготовления - металл, плафоны имеют прозрачный цвет. Гармоничная форма и продуманная функциональность данной модели несомненно придаст теплую и радостную атмосферу, независимо от того куда вы собираетесь ее установить. подвесной светильник LSP-9630 подойдет для помещения площадью 3.3 кв. м, это устройство оснащено лампочками в колличестве - 1 шт. Номинальная мощность составляет 60 ватт. Степень пылевлагозащищенности по международной классификации (Ingress Protection Rating) - IP20. В нашем интернет магазине Sevenlight.ru вы можете купить подвесной светильник Lussole LSP-9630 по цене с доставкой по Москве и всей России прямо сейчас! В нашем интернет магазине вы имеете уникальную возможность купить данный товар по самой низкой цене в интернете!!! Чтобы получить скидку, используйте код купона REGION при оформлении заказа.";"Мин. сумма 100 р. ";true;true;светильник;подвесной;Лофт;"для кухни";прозрачный;стеклянные;1;3.3;60;хром;прозрачный;конусный;металл;стекло;накаливания;60;"без пульта";;E27;20;180;260;0;0;;;220;LSP-9630;Loft;"основной товар";"18 месяцев";"на потолок";220;нет;НЕТ;Италия;Lussole;;;;;;;;;;1;;;;;;
S000309;0;http://sevenlight.ru/products/spot-lightstar-ballo-051176;1887;2641;спот;RUR;"Споты/Споты по стилю/Споты хай-тек";;http://sevenlight.ru/files/products/lightstar_051176.png;false;false;true;Lightstar;S000309;"спот Lightstar 051176";" - хорошее решение для интерьеров с небольшими потолками. спот прекрасно впишется не только в коридор или спальню, но также и в остальные помещения вашего интерьера. могут быть большими по размеру и быть подходящими и для больших помещений с низкими потолками. Отличным вариантом будет спот 051176 Ballo бренда Lightstar, Италия. Данный бренд зарекомендовал себя как надежный изготовитель люстр и светильников, пользующийся хорошим спросом среди российских покупателей. Интересный внешний вид изделия спот 051176 сочетается с надежным качеством и практичностью. Эта модель прекрасно впишется в хай-тек интерьер, и не только. Цвет каркаса изделия - белый, а материал изготовления - металл, плафоны имеют белый цвет. Гармоничная форма и продуманная функциональность данной модели несомненно придаст теплую и радостную атмосферу, независимо от того куда вы собираетесь ее установить. спот 051176 подойдет для помещения площадью 2.8 кв. м, это устройство оснащено лампочками в колличестве - 1 шт. Номинальная мощность составляет 50 ватт. Степень пылевлагозащищенности по международной классификации (Ingress Protection Rating) - IP20. В нашем интернет магазине Sevenlight.ru вы можете купить спот Lightstar 051176 по цене с доставкой по Москве и всей России прямо сейчас! В нашем интернет магазине вы имеете уникальную возможность купить данный товар по самой низкой цене в интернете!!! Чтобы получить скидку, используйте код купона REGION при оформлении заказа.";"Мин. сумма 100 р. ";true;true;спот;;хай-тек;"для магазина";белый;металлические;1;2.8;50;белый;белый;конусный;металл;металл;галогеновая;50;"без пульта";;GU10;20;65;197;;;;;230;051176;Ballo;"основной товар";"18 месяцев";"на потолок";230;нет;НЕТ;Италия;Lightstar;;;;;;;;;;1;;;;;;
