sku;visible;#url#;price;"compare price";typePrefix;currencyId;category;market_category;images;store;pickup;delivery;brand;vendorCode;name;description;sales_notes;manufacturer_warranty;seller_warranty;Тип;Подтип;Стиль;Интерьер;Цвет;"Виды материалов";"Количество ламп";"Площадь освещения, м2";"Общая мощность, W";"Цвет арматуры";"Цвет плафонов";"Форма плафона";"Материал арматуры";"Материал плафонов";"Тип лампочки (основной)";"Мощность лампы, W";"Пульт ДУ";"Лампы в комплекте";"Тип цоколя";"Степень защиты, IP";"Диаметр, мм";"Высота, мм";"Длина, мм";"Ширина, мм";"Глубина, мм";"Температура света, K";"Напряжение, V";"Артикул производителя";Коллекция;"Группа товаров";Гарантия;"Место установки";питание;street;LED;Страна;Производитель;delivery-options;"Сфера применения";"Световой поток, лм";"Тип лампочки (дополнительный)";"Тип элемента питания";"Тип цоколя (дополнительный)";url;featured;variant;currency;weight;stock;"meta title";"meta keywords";"meta description";annotation
S000201;0;http://sevenlight.ru/products/podvesnoj-svetilnik-artpole-kringel-001167;32214;53690;светильник;RUR;"Светильники/Светильники по форме/Светильники овальные";;http://sevenlight.ru/files/products/artpole_001167.png,http://sevenlight.ru/files/products/artpole_001167-1.png;false;false;true;Artpole;S000201;"светильник подвесной Artpole 001167";" - хорошее решение для интерьеров с небольшими потолками. подвесной светильник прекрасно впишется не только в коридор или спальню, но также и в остальные помещения вашего интерьера. могут быть большими по размеру и быть подходящими и для больших помещений с низкими потолками. Отличным вариантом будет подвесной светильник 001167 Kringel бренда Artpole, Китай. Данный бренд зарекомендовал себя как надежный изготовитель люстр и светильников, пользующийся хорошим спросом среди российских покупателей. Интересный внешний вид изделия подвесной светильник 001167 сочетается с надежным качеством и практичностью. Эта модель прекрасно впишется в лофт интерьер, и не только. Цвет каркаса изделия - серый, а материал изготовления - металл, плафоны имеют желтый цвет. Гармоничная форма и продуманная функциональность данной модели несомненно придаст теплую и радостную атмосферу, независимо от того куда вы собираетесь ее установить. подвесной светильник 001167 подойдет для помещения площадью 8.3 кв. м, это устройство оснащено лампочками в колличестве - 1 шт. Номинальная мощность составляет 150 ватт. Степень пылевлагозащищенности по международной классификации (Ingress Protection Rating) - IP20. В нашем интернет магазине Sevenlight.ru вы можете купить подвесной светильник Artpole 001167 по цене с доставкой по Москве и всей России прямо сейчас! В нашем интернет магазине вы имеете уникальную возможность купить данный товар по самой низкой цене в интернете!!! Чтобы получить скидку, используйте код купона REGION при оформлении заказа.";"Мин. сумма 100 р. ";true;true;светильник;подвесной;Хай-тек;"для кафе и ресторанов";желтый;пластиковые;1;8.3;150;серый;желтый;овал;металл;пластик;галогеновая;150;"без пульта";;R7S;20;;2000;560;425;;;230;001167;Kringel;"основной товар";"18 месяцев";"на потолок";230;нет;НЕТ;Китай;Artpole;"
	
	";;;;;;;;;1;;;;;;
S000202;0;http://sevenlight.ru/products/podvesnaya-lyustra-eurosvet-300435-antichnaya-bronza;4318;0;люстра;RUR;"Люстры/Люстры  по цене/Недорогие подвесные люстры";;http://sevenlight.ru/files/products/eurosvet_300435antichnayabronza.png,http://sevenlight.ru/files/products/eurosvet_300435antichnayabronza-1.png;false;false;true;Eurosvet;S000202;"люстра подвесная Eurosvet 30043/5 античная бронза";" - хорошее решение для интерьеров с небольшими потолками. подвесная люстра прекрасно впишется не только в коридор или спальню, но также и в остальные помещения вашего интерьера. могут быть большими по размеру и быть подходящими и для больших помещений с низкими потолками. Отличным вариантом будет подвесная люстра 30043/5 античная бронза 30043 бренда Eurosvet, Китай. Данный бренд зарекомендовал себя как надежный изготовитель люстр и светильников, пользующийся хорошим спросом среди российских покупателей. Интересный внешний вид изделия подвесная люстра 30043/5 античная бронза сочетается с надежным качеством и практичностью. Эта модель прекрасно впишется в классика интерьер, и не только. Цвет каркаса изделия - бронза, а материал изготовления - металл, плафоны имеют белый цвет. Гармоничная форма и продуманная функциональность данной модели несомненно придаст теплую и радостную атмосферу, независимо от того куда вы собираетесь ее установить. подвесная люстра 30043/5 античная бронза подойдет для помещения площадью 16.7 кв. м, это устройство оснащено лампочками в колличестве - 5 шт. Номинальная мощность составляет 300 ватт. Степень пылевлагозащищенности по международной классификации (Ingress Protection Rating) - IP20. В нашем интернет магазине Sevenlight.ru вы можете купить подвесная люстра Eurosvet 30043/5 античная бронза по цене с доставкой по Москве и всей России прямо сейчас! В нашем интернет магазине вы имеете уникальную возможность купить данный товар по самой низкой цене в интернете!!! Чтобы получить скидку, используйте код купона REGION при оформлении заказа.";"Мин. сумма 100 р. ";true;true;люстра;подвесная;Кантри;"для спальни";белый;стеклянные;5;16.7;300;Бронза;белый;конусный;металл;стекло;накаливания;60;"без пульта";нет;E27;20;540;300;0;0;;;230;"30043/5 античная бронза";30043;"основной товар";"18 месяцев";"на потолок";230;нет;НЕТ;Китай;Eurosvet;;;;;;;;;;1;;;;;;
S000203;1;http://sevenlight.ru/products/podvesnaya-lyustra-st-luce-indovinello-sl66640303;9660;0;люстра;RUR;"Люстры/Люстры  по цене/Недорогие подвесные люстры";;http://sevenlight.ru/files/products/stluce_sl66640303.png,http://sevenlight.ru/files/products/stluce_sl66640303-1.png;false;false;true;"St Luce";S000203;"люстра подвесная ST Luce SL666.403.03";" - хорошее решение для интерьеров с небольшими потолками. подвесная люстра прекрасно впишется не только в коридор или спальню, но также и в остальные помещения вашего интерьера. могут быть большими по размеру и быть подходящими и для больших помещений с низкими потолками. Отличным вариантом будет подвесная люстра SL666.403.03 Indovinello бренда ST Luce, Италия. Данный бренд зарекомендовал себя как надежный изготовитель люстр и светильников, пользующийся хорошим спросом среди российских покупателей. Интересный внешний вид изделия подвесная люстра SL666.403.03 сочетается с надежным качеством и практичностью. Эта модель прекрасно впишется в арт-деко интерьер, и не только. Цвет каркаса изделия - хром, а материал изготовления - металл, плафоны имеют прозрачный цвет. Гармоничная форма и продуманная функциональность данной модели несомненно придаст теплую и радостную атмосферу, независимо от того куда вы собираетесь ее установить. подвесная люстра SL666.403.03 подойдет для помещения площадью 6.7 кв. м, это устройство оснащено лампочками в колличестве - 3 шт. Номинальная мощность составляет 120 ватт. Степень пылевлагозащищенности по международной классификации (Ingress Protection Rating) - IP20. В нашем интернет магазине Sevenlight.ru вы можете купить подвесная люстра ST Luce SL666.403.03 по цене с доставкой по Москве и всей России прямо сейчас! В нашем интернет магазине вы имеете уникальную возможность купить данный товар по самой низкой цене в интернете!!! Чтобы получить скидку, используйте код купона REGION при оформлении заказа.";"Мин. сумма 100 р. ";true;true;люстра;подвесная;Арт-деко;"для гостиной";прозрачный;хрустальные;3;6.7;120;хром;прозрачный;декоративный;металл;хрусталь;накаливания;40;"без пульта";;E14;20;560;480;0;0;;;220;SL666.403.03;Indovinello;"основной товар";"18 месяцев";"на потолок";220;нет;НЕТ;Италия;"ST Luce";"
	
	";;;;;;;;;1;;;;;;
S000204;1;http://sevenlight.ru/products/kaskadnaya-lyustra-favourite-mantra-1664-3u;12650;0;люстра;RUR;"Люстры/Люстры по стране/Люстры Германия";;http://sevenlight.ru/files/products/favourite_16643u.png,http://sevenlight.ru/files/products/favourite_16643u-1.png;false;false;true;Favourite;S000204;"люстра каскадная Favourite 1664-3U";" - хорошее решение для интерьеров с небольшими потолками. каскадная люстра прекрасно впишется не только в коридор или спальню, но также и в остальные помещения вашего интерьера. могут быть большими по размеру и быть подходящими и для больших помещений с низкими потолками. Отличным вариантом будет каскадная люстра 1664-3U Mantra бренда Favourite, Германия. Данный бренд зарекомендовал себя как надежный изготовитель люстр и светильников, пользующийся хорошим спросом среди российских покупателей. Интересный внешний вид изделия каскадная люстра 1664-3U сочетается с надежным качеством и практичностью. Эта модель прекрасно впишется в классика интерьер, и не только. Цвет каркаса изделия - золото, а материал изготовления - металл, плафоны имеют прозрачный цвет. Гармоничная форма и продуманная функциональность данной модели несомненно придаст теплую и радостную атмосферу, независимо от того куда вы собираетесь ее установить. каскадная люстра 1664-3U подойдет для помещения площадью 6.7 кв. м, это устройство оснащено лампочками в колличестве - 3 шт. Номинальная мощность составляет 120 ватт. Степень пылевлагозащищенности по международной классификации (Ingress Protection Rating) - IP20. В нашем интернет магазине Sevenlight.ru вы можете купить каскадная люстра Favourite 1664-3U по цене с доставкой по Москве и всей России прямо сейчас! В нашем интернет магазине вы имеете уникальную возможность купить данный товар по самой низкой цене в интернете!!! Чтобы получить скидку, используйте код купона REGION при оформлении заказа.";"Мин. сумма 100 р. ";true;true;люстра;каскадная;Классика;"для гостиной";прозрачный;хрустальные;3;6.7;120;Золотой;прозрачный;декоративный;металл;хрусталь;галогеновая;40;"без пульта";;G9;20;200;570;0;0;;;220;1664-3U;Mantra;"основной товар";"18 месяцев";"на потолок";220;нет;НЕТ;Германия;Favourite;"
	
	";;;;;;;;;1;;;;;;
S000205;0;http://sevenlight.ru/products/podvesnoj-svetilnik-luce-solara-bambino-10151s-yellow;1584;2218;светильник;RUR;"Светильники/Светильники по форме/Светильники круглые";;http://sevenlight.ru/files/products/lucesolara_10151syellow.png;false;false;true;"Luce Solara";S000205;"светильник подвесной Luce Solara 1015/1S Yellow";" имеют большую популярность и предназначаются для множества интерьеров, главное правильно выбрать подходящий вариант из категории. Если Вам нужно купить надежные и привлекательные. Хорошим выбором для обустройства вашего жилища будет подвесной светильник Luce Solara 1015/1S Yellow(Китай).Важно обратить внимание, светильник 1015/1S Yellow Luce Solara соответствуем всем стандартам качества, это значит, вам не стоит переживать за надежность данного изделия, ведь светильник 1015/1S Yellow Bambino Yellow &mdash; сертифицированный продукт, прошедший все надлежащие проверки. Фабрика Luce Solara очень тщательно следит за уровнем качества выпускаемой продукции. светильник Luce Solara 1015/1S Yellow серии Bambino Yellow имеет соответствующий дизайн в стиле - современный. Материал, используемый в модели Luce Solara Bambino Yellow &mdash; это металл, а гармонично подобранные цвета дизайнерами фабрики Luce Solara, из которых состоит светильник 1015/1S Yellow &mdash; это разноцветный, белый. подвесной светильник Luce Solara Bambino Yellow отлично подойдет как для детской, так и для других помещений, исполненных в стиле современный. светильник 1015/1S Yellow в среднем освещает помещение площадью 2.2 кв. м. Лампочек данная модель имеет 1xE27, общая мощность которых - 40 ватт. Показатель защиты от влаги - IP20. подвесной светильник Luce Solara1015/1S Yellow удачно сочетает в себе внешний вид, выполненный в стиле современный и функциональные данные. Что несомненно является преимуществом приятной покупки. Купить модель светильник 1015/1S Yellow производителя Luce Solara за";"Мин. сумма 100 р. ";true;true;светильник;подвесной;современный;"для детской";желтый;пластиковые;1;2.2;40;разноцветный;белый;круглый;металл;пластик;накаливания;40;"без пульта";;E27;20;350;800;;;;;220;"1015/1S Yellow";"Bambino Yellow";"основной товар";"18 месяцев";"на потолок";220;нет;НЕТ;Китай;"Luce Solara";;;;;;;;;;1;;;;;;
S000206;0;http://sevenlight.ru/products/ulichnyj-svetilnik-ld-lighting-ld-v855;14500;17100;светильник;RUR;"Светильники/Светильники по типу/Светильники влагозащищенные";;http://sevenlight.ru/files/products/ldlighting_ldv855-1.png,http://sevenlight.ru/files/products/ldlighting_ldv855-2.png,http://sevenlight.ru/files/products/ldlighting_ldv855-3.png,http://sevenlight.ru/files/products/ldlighting_ldv855.png;false;false;true;LD-Lighting;S000206;"светильник LD-Lighting LD-В855";" - хорошее решение для интерьеров с небольшими потолками. светильник прекрасно впишется не только в коридор или спальню, но также и в остальные помещения вашего интерьера. могут быть большими по размеру и быть подходящими и для больших помещений с низкими потолками. Отличным вариантом будет светильник LD-В855 LD-В бренда LD-Lighting, Испания. Данный бренд зарекомендовал себя как надежный изготовитель люстр и светильников, пользующийся хорошим спросом среди российских покупателей. Интересный внешний вид изделия светильник LD-В855 сочетается с надежным качеством и практичностью. Эта модель прекрасно впишется в современный интерьер, и не только. Цвет каркаса изделия - бронза, а материал изготовления - металл, плафоны имеют белый цвет. Гармоничная форма и продуманная функциональность данной модели несомненно придаст теплую и радостную атмосферу, независимо от того куда вы собираетесь ее установить. светильник LD-В855 подойдет для помещения площадью 1.4 кв. м, это устройство оснащено лампочками в колличестве - 1 шт. Номинальная мощность составляет 26 ватт. Степень пылевлагозащищенности по международной классификации (Ingress Protection Rating) - IP54. В нашем интернет магазине Sevenlight.ru вы можете купить светильник LD-Lighting LD-В855 по цене с доставкой по Москве и всей России прямо сейчас! В нашем интернет магазине вы имеете уникальную возможность купить данный товар по самой низкой цене в интернете!!! Чтобы получить скидку, используйте код купона REGION при оформлении заказа.";"Мин. сумма 100 р. ";true;true;светильник;;Современный;;бронза;металлические;1;1.4;26;Бронза;белый;цилиндр;металл;стекло;энергосберегающая;26;"без пульта";;E27;54;80;650;0;0;;;220;LD-В855;LD-В;"основной товар";"18 месяцев";"в грунт";220;да;НЕТ;Испания;LD-Lighting;"
	
	";;;;;;;;;1;;;;;;
